{
  "schema_version": "1.0",
  "repository": {
    "host": "github.example.test",
    "owner": "sample-owner",
    "name": "sample-repo",
    "id": "123456789"
  },
  "source": {
    "sha": "aaaaaaaaaaaaaaaaaaaaaaaaaaaaaaaaaaaaaaaa",
    "ref": "refs/heads/sample"
  },
  "gate_contract": {
    "id": "FRAMEWORK-GATE-CONTRACT-001",
    "version": "1.0",
    "sha256": "cccccccccccccccccccccccccccccccccccccccccccccccccccccccccccccccc"
  },
  "workflow": {
    "path": ".github/workflows/verify-pipeline.yml",
    "revision_sha": "bbbbbbbbbbbbbbbbbbbbbbbbbbbbbbbbbbbbbbbb",
    "identity": "sample-owner/sample-repo/.github/workflows/verify-pipeline.yml@refs/heads/sample"
  },
  "provider_run": {
    "provider": "example-ci",
    "run_id": "1234567890",
    "attempt": 1,
    "event": "push",
    "ref": "refs/heads/sample",
    "url": "https://ci.example.test/runs/1234567890"
  },
  "required_check_manifest_sha256": "dddddddddddddddddddddddddddddddddddddddddddddddddddddddddddddddd",
  "checks": [
    {
      "logical_id": "metadata-audit",
      "provider_check_id": "check-1001",
      "name": "Metadata & Artifact Audit",
      "conclusion": "success",
      "head_sha": "aaaaaaaaaaaaaaaaaaaaaaaaaaaaaaaaaaaaaaaa"
    }
  ],
  "evidence": [
    {
      "evidence_id": "gate-record",
      "sha256": "ffffffffffffffffffffffffffffffffffffffffffffffffffffffffffffffff",
      "reference": "https://ci.example.test/evidence/gate-record"
    }
  ],
  "issuer": {
    "provider": "example-attestor",
    "identity": "sample-owner/sample-repo/.github/workflows/verify-pipeline.yml@refs/heads/sample"
  },
  "issued_at": "2026-10-24T18:00:00Z"
}
